{
  "spec_version": "1.0.0",
  "source": {
    "mime_type": "message/rfc822",
    "sha256": "fbe186b75fa8fa4c582b843d6897afffbf3b497ab94b26b36b564de7461d8d41",
    "size_bytes": 477,
    "filename": "multipart-alternative.eml"
  },
  "metadata": {
    "title": "Multipart test",
    "author": "alice@example.com",
    "language": null,
    "created": "2026-01-01T00:00:00+00:00",
    "modified": null,
    "page_count": null,
    "word_count": 6,
    "extra": {
      "eml:from": "alice@example.com",
      "eml:to": "bob@example.com",
      "eml:body_source": "text/plain"
    }
  },
  "content": {
    "text": "Plain version preferred by the extractor.",
    "pages": null,
    "sections": null
  },
  "warnings": [],
  "extractor": { "name": "knovas-extract-python", "version": "0.1.0.dev0" }
}
